<?xml version="1.0" encoding="UTF-8"?>
<reservations xmlns="http://www.NCar.com/"
    xmlns:xsi="http://www.w3.org/2001/XMLSchema-instance"
    xsi:schemaLocation="http://www.NCar.com/ reservations.xsd"
    xmlns:c="http://www.NCar.com/commonTypes.xsd">


    <partnerName>A2A3</partnerName>
    <expertiseName>A4S5</expertiseName>
    <date>2022-12-08T12:00:00Z</date>


    <!-- Reserva COD 12 -->
    <reservation>

        <code>12</code>
        <Start>2022-12-08T08:00:00Z</Start>
        <End>2022-12-08T12:00:00Z</End>
        <address>
            <street>Rua do Curral</street>
            <numDoor>12</numDoor>
            <zipCode>4610-156</zipCode>
            <city>Felgueiras</city>
            <coordinates></coordinates> <!-- caso não seja possível fornecer coordenadas basta apenas
            não chamar elemento coordinates ou chamar e não chamar latitude e longitude-->
        </address>

        <vehicleInfo>
            <brand>Ford</brand>
            <model>Fiesta</model>
            <fuel>Diesel</fuel>
            <transmission>Manual</transmission>
            <year>1998</year>
            <horsePower>76</horsePower>
        </vehicleInfo>
        <typeOfContact>
            <client>
                <name>José Meireles</name>
                <property>Owner</property>
            </client>
        </typeOfContact>
    </reservation>

    <reservation>
        <code>14</code>
        <Start>2022-12-08T07:00:00Z</Start>
        <End>2022-12-08T11:00:00Z</End>
        <address>
            <street>Rua do Curral</street>
            <numDoor>12</numDoor>
            <zipCode>4615-172</zipCode>
            <city>Lixa</city>
            <coordinates>
                <latitude>23.4</latitude> <!-- Caso seja possível enviar coordenadas : xs:decimal -->
                <longitude>35</longitude> <!-- Caso seja possível enviar coordenadas xs:integer -->
            </coordinates>
        </address>

        <vehicleInfo>
            <brand>Opel</brand>
            <model>Corsa</model>
            <fuel>Gasoline</fuel>
            <transmission>Manual</transmission>
            <year>2008</year>
            <horsePower>80</horsePower>
        </vehicleInfo>
        <typeOfContact>
            <client>
                <name>Ana Ribeiro</name>
                <property>Not Owner</property>
            </client>
        </typeOfContact>
    </reservation>


</reservations>